<!ELEMENT session (metadata?, recordingscript)><!ELEMENT script (metadata?, recordingscript)><!ATTLIST session id CDATA #REQUIRED><!ATTLIST script id CDATA #REQUIRED><!ELEMENT metadata (key, value)+><!ELEMENT key (#PCDATA)><!ELEMENT value (#PCDATA)*><!ELEMENT recordingscript (section)+><!ATTLIST section name CDATA #IMPLIED                  speakerdisplay CDATA #IMPLIED                  order CDATA #IMPLIED                  mode CDATA #IMPLIED                  promptphase CDATA #IMPLIED><!ELEMENT section (nonrecording | recording)+><!ELEMENT nonrecording (mediaitem)><!ELEMENT recording (recinstructions?, recprompt, reccomment?) ><!ATTLIST recording	itemcode CDATA #REQUIRED					recduration CDATA #REQUIRED					prerecdelay CDATA #IMPLIED					postrecdelay CDATA #IMPLIED					finalsilence CDATA #IMPLIED					beep CDATA #IMPLIED					rectype CDATA #IMPLIED><!ELEMENT recinstructions (#PCDATA) ><!ATTLIST recinstructions	mimetype CDATA #IMPLIED							src CDATA #IMPLIED><!ELEMENT recprompt (mediaitem)><!ELEMENT reccomment (#PCDATA)><!ELEMENT mediaitem (#PCDATA)*><!ATTLIST mediaitem	mimetype CDATA #IMPLIED					src CDATA #IMPLIED					alt CDATA #IMPLIED					autoplay CDATA #IMPLIED					modal CDATA #IMPLIED					width CDATA #IMPLIED					height CDATA #IMPLIED					volume CDATA #IMPLIED>